{
  "meta": {
    "id_prefix": "SPB",
    "version": "1.0.1",
    "title": "Smart Prompt Booster (SPB) Requirements (repaired)",
    "author": "Requirements Drafter (audited)",
    "date": "2025-08-12"
  },
  "context": {
    "business_goal": "Provide a deterministic tool that converts a user-selected image into a labeled base_prompt plus modular Style Packs, enforces safety-by-default, and exports platform-ready strings for A1111, SDXL and ComfyUI.",
    "stakeholders": [
      "Product Manager",
      "Prompt Engineers",
      "Frontend Engineers",
      "Backend Engineers",
      "QA Engineers",
      "Safety/Policy Team",
      "End Users"
    ],
    "assumptions": [
      "The system SHALL provide five default Style Packs: cinematic, analog film, anime, product, portrait.",
      "User-defined packs SHALL follow the pack schema and SHALL be validated on registration.",
      "Image metadata MAY be provided as input; automated scene extraction is out-of-scope for MVP.",
      "Pack-level toggles (on/off) SHALL be supported. Subcomponent toggles MAY be deferred to later releases.",
      "Acceptance tests SHALL use acceptance-test IDs in the SPB-1001.. range separate from requirement IDs."
    ],
    "out_of_scope": [
      "Automatic scene/feature extraction (MVP)",
      "Automatic retraining or model parameter tuning",
      "On-device generation; system only produces prompt outputs and parameter suggestions."
    ],
    "non_functional": {
      "performance": "Prompt generation latency SHALL be <= 2000 ms for a typical image with a single pack on a mid-tier server (automated test: prompt_generation_time_ms <= 2000).",
      "security": "User-supplied packs and image metadata SHALL be sanitized; system MUST prevent arbitrary code execution and MUST log sanitizations to metadata.removed_tokens.",
      "reliability": "Merging and exports SHALL be deterministic; regression tests SHALL assert identical_inputs_produce_identical_outputs == true.",
      "usability": "UI SHALL present clearly labeled 'base_prompt' and 'negative_prompt' fields, visible pack toggles, and one-click exports.",
      "compliance": "Safe variant SHALL enforce safety-by-default; model-sensitive tokens SHALL be explicitly marked (recommended marker '[SDXL_ONLY]')."
    }
  },
  "functional_requirements": [
    {
      "id": "SPB-0001",
      "statement": "Ingest a user-selected image and optional metadata and return a canonical input record containing image_id (required), optional filename, optional hash, and optional EXIF fields.",
      "rationale": "Standardize inputs for downstream traceability.",
      "acceptance_tests": [
        {
          "id": "SPB-1001",
          "given": "Image input with metadata: image_id=img_123abc, filename=sunset.jpg, hash=abcd1234, EXIF.camera=Canon EOS",
          "when": "System ingests the provided image input",
          "then": "Expected canonical record stored. Pass criteria: canonical_record.image_id == 'img_123abc'; canonical_record.metadata.filename == 'sunset.jpg'; canonical_record.metadata.hash == 'abcd1234'; canonical_record.metadata.EXIF.camera == 'Canon EOS'"
        }
      ],
      "priority": "MUST",
      "dependencies": []
    },
    {
      "id": "SPB-0002",
      "statement": "Generate labeled 'base_prompt' and 'negative_prompt' fields for the provided image and enabled packs. The output fields MUST be exactly named 'base_prompt' and 'negative_prompt'.",
      "rationale": "Consistent field names required by downstream tools.",
      "acceptance_tests": [
        {
          "id": "SPB-1002",
          "given": "Image image_id=img_123abc with selected_packs=['cinematic'] and variant='Bold'",
          "when": "System generates prompts for the image with cinematic pack enabled",
          "then": "Expected base_prompt and negative_prompt strings returned and packs.cinematic.enabled == true. Pass criteria (machine-checkable): base_prompt contains substring 'golden-hour cinematic'; negative_prompt contains substring 'watermark'; A1111 export contains '--cfg' and '--steps' with numeric values within declared ranges; SDXL export contains 'PROMPT:' and 'NEG:'; ComfyUI export contains '\"prompt\"' and '\"negative\"' keys."
        }
      ],
      "priority": "MUST",
      "dependencies": [
        "SPB-0001"
      ]
    },
    {
      "id": "SPB-0003",
      "statement": "Provide five default Style Packs: cinematic, analog film, anime, product, portrait. Each pack SHALL include name, one-sentence description (<=25 words), tokens array, optional subcomponent metadata, and explicit model-sensitive markers if applicable.",
      "rationale": "Ship validated, testable default packs.",
      "acceptance_tests": [
        {
          "id": "SPB-1003",
          "given": "Request default pack definitions for analog film and anime",
          "when": "System returns default packs",
          "then": "Pass criteria: packs include expected tokens (e.g., 'film grain' in analog film); pack descriptions are <=25 words; model-sensitive markers present where required; SDXL export includes explicit model-sensitive marker if applicable."
        }
      ],
      "priority": "MUST",
      "dependencies": [
        "SPB-0002"
      ]
    },
    {
      "id": "SPB-0004",
      "statement": "Allow pack-level toggles for each pack. When multiple packs are enabled, merge tokens deterministically as: (1) base_prompt tokens first, (2) enabled default packs in fixed order [cinematic, analog film, anime, product, portrait], (3) enabled user-defined packs in registration order. Perform exact-string deduplication and preserve first-occurrence precedence.",
      "rationale": "Deterministic concatenation ensures reproducible prompts and simplifies testing.",
      "acceptance_tests": [
        {
          "id": "SPB-1004",
          "given": "Image with selected_packs=['portrait','cinematic','analog film'] and all three enabled",
          "when": "System merges base_prompt with enabled packs",
          "then": "Pass criteria: merged prompt preserves base_prompt tokens first; default-pack tokens appear in fixed order after base_prompt; exact-string duplicates removed (each token appears only once); merged prompt contains 'film grain' exactly once; A1111 export includes the merged prompt and expected --neg clause."
        }
      ],
      "priority": "MUST",
      "dependencies": [
        "SPB-0002",
        "SPB-0003"
      ]
    },
    {
      "id": "SPB-0005",
      "statement": "Produce three variants for each output: Safe, Bold, and Experimental. Each variant SHALL include a one-sentence descriptor (<=25 words), cfg_range [min,max], cfg_default within range, steps_range [min,max], steps_default within range, and ordered sampler suggestions.",
      "rationale": "Provide ready-to-use variants with deterministic parameter guidance.",
      "acceptance_tests": [
        {
          "id": "SPB-1005",
          "given": "Request Safe variant for image with 'product' pack enabled",
          "when": "System returns Safe variant parameters and prompts",
          "then": "Pass criteria: cfg_default within declared cfg_range and equals expected default (e.g., 6); steps_default within declared range; samplers list non-empty; negative_prompt contains 'watermark' and contains no banned terms."
        },
        {
          "id": "SPB-1006",
          "given": "Request Experimental variant for image with 'cinematic' and 'anime' packs enabled",
          "when": "System returns Experimental variant",
          "then": "Pass criteria: cfg_default and steps_default within declared wider ranges; sampler list contains at least one advanced sampler; variant descriptor includes exact substring 'Experimental' or 'Warning: Experimental'."
        }
      ],
      "priority": "MUST",
      "dependencies": [
        "SPB-0002",
        "SPB-0003"
      ]
    },
    {
      "id": "SPB-0006",
      "statement": "Export platform-ready strings for A1111, SDXL, and ComfyUI for any generated variant. Exports MUST include prompt text and platform-specific parameter annotations (A1111: '--neg' and '--cfg/--steps/--sampler'; SDXL: 'PROMPT:'/'NEG:' plus params JSON-like suffix and model-sensitive markers; ComfyUI: JSON-like snippet with keys 'prompt','negative','params').",
      "rationale": "Provide predictable, copy-paste-ready exports for common tooling.",
      "acceptance_tests": [
        {
          "id": "SPB-1007",
          "given": "Generate exports for A1111/SDXL/ComfyUI for a Bold variant with 'portrait' pack enabled",
          "when": "System returns export strings",
          "then": "Pass criteria: A1111 export contains '--neg' and numeric '--cfg'/'--steps' within declared ranges; SDXL export contains 'PROMPT:' and 'NEG:' and explicit model-sensitive marker '[SDXL_ONLY]' when applicable; ComfyUI export contains '\"prompt\"' and '\"params\"' keys."
        }
      ],
      "priority": "MUST",
      "dependencies": [
        "SPB-0002",
        "SPB-0005"
      ]
    },
    {
      "id": "SPB-0007",
      "statement": "Enforce safety-by-default: the Safe variant MUST remove or neutralize sexual, violent, illegal, or otherwise disallowed content. All variants SHALL be scanned for disallowed terms; the system MUST refuse to include disallowed content and MUST log removal actions to output metadata.removed_tokens.",
      "rationale": "Align with policy and ensure safety-by-default.",
      "acceptance_tests": [
        {
          "id": "SPB-1008",
          "given": "Image with user_override additional_tokens containing 'some-risky-token' and variant='Safe'",
          "when": "System generates Safe variant",
          "then": "Pass criteria: base_prompt does not contain blocked terms; metadata.removed_tokens includes 'some-risky-token'; exports do not include disallowed content."
        }
      ],
      "priority": "MUST",
      "dependencies": [
        "SPB-0002",
        "SPB-0005"
      ]
    },
    {